653793,Woolworths Sliced Carrot Sultana & Walnut Loaf 500g,$6.50,$1.30 / 100G,/shop/productdetails/653793/woolworths-sliced-carrot-sultana-walnut-loaf
243014,Toscano Sourdough Pizza Base 2 Pack,N/A,N/A,/shop/productdetails/243014/toscano-sourdough-pizza-base
221763,Woolworths Sesame Bagels 4 Pack,N/A,N/A,/shop/productdetails/221763/woolworths-sesame-bagels
406453,Woolworths Banana Choc Bread 5 Pack,$6.50,$1.30 / 100G,/shop/productdetails/406453/woolworths-banana-choc-bread
118177,Woolworths Raspberry & White Choc Loaded Muffins 4 Pack,$7.00,$1.75 / 1EA,/shop/productdetails/118177/woolworths-raspberry-white-choc-loaded-muffins
270583,Abe's Bagel Bakery Sesame Seed Bagels 360g 4 Pack,$5.00,$1.25 / 1EA,/shop/productdetails/270583/abe-s-bagel-bakery-sesame-seed-bagels
814598,Mr Kipling Choc Slice 6 Pack,$5.00,$0.83 / 1EA,/shop/productdetails/814598/mr-kipling-choc-slice
40285,Woolworths Strawberry Iced Donuts 4 Pack,$4.75,$1.19 / 1EA,/shop/productdetails/40285/woolworths-strawberry-iced-donuts
186854,Woolworths Mud Cake Caramel 600g,$6.40,$1.07 / 100G,/shop/productdetails/186854/woolworths-mud-cake-caramel
103219,Abbott's Bakery Gluten Free Farmhouse Wholemeal Bread Slice Loaf 500g,$7.80,$1.56 / 100G,/shop/productdetails/103219/abbott-s-bakery-gluten-free-farmhouse-wholemeal-bread-slice-loaf
802853,Lawson's Wholemeal Traditional Bread 750g,$5.80,$0.77 / 100G,/shop/productdetails/802853/lawson-s-wholemeal-traditional-bread
682573,Abe's Bagel Bakery Blueberry Bagels 4 Pack,$5.00,$1.25 / 1EA,/shop/productdetails/682573/abe-s-bagel-bakery-blueberry-bagels
815271,Helga's Gluten Free Mixed Grains 500g,$7.50,$1.50 / 100G,/shop/productdetails/815271/helga-s-gluten-free-mixed-grains
201815,Abe's Low Carb Bagels 360g,$5.00,$1.25 / 1EA,/shop/productdetails/201815/abes-abe-s-low-carb-bagels
243674,Simson's Pantry Mini Pizza Bases Plain 6 Pack,$4.50,$1.88 / 100G,/shop/productdetails/243674/simson-s-pantry-mini-pizza-bases-plain
140171,Woolworths Free From Gluten White Burger Buns 4 Pack,$5.50,$1.72 / 100G,/shop/productdetails/140171/woolworths-free-from-gluten-white-burger-buns
7927,Woolworths Cinnamon Donuts 6 Pack,$2.80,$0.47 / 1EA,/shop/productdetails/7927/woolworths-cinnamon-donuts
242952,Toscano French Style Madeleines Strawberry Jam Filled 238g,$5.00,$2.10 / 100G,/shop/productdetails/242952/toscano-french-style-madeleines-strawberry-jam-filled
184268,Helga's 50% Lower Carb 5 Seeds Loaf 700g,$5.50,$0.79 / 100G,/shop/productdetails/184268/helga-s-50-lower-carb-5-seeds-loaf
169921,Woolworths Lemon Poppyseed Muffins 4 Pack,$7.00,$1.75 / 1EA,/shop/productdetails/169921/woolworths-lemon-poppyseed-muffins
242617,Toscano French Style Madeleines Choc Cream Filled 238g,$5.00,$2.10 / 100G,/shop/productdetails/242617/toscano-french-style-madeleines-choc-cream-filled
384987,Mission Pizza Bases Round 2 Pack 200g,$4.60,$2.30 / 100G,/shop/productdetails/384987/mission-pizza-bases-round
70720,Woolworths Plantitude Granola Cookies 5 Pack,$4.00,$0.80 / 1EA,/shop/productdetails/70720/woolworths-plantitude-granola-cookies
168703,Balconi Trancetto Cocoa 10 Pack,$4.50,$0.45 / 1EA,/shop/productdetails/168703/balconi-trancetto-cocoa
940893,Noshu 97% Sugar Free Dark Choc & Raspberry Donut 45g,$4.00,$8.89 / 100G,/shop/productdetails/940893/noshu-97-sugar-free-dark-choc-raspberry-donut
337153,Woolworths Cheese Roll 4 Pack,$4.50,$1.13 / 1EA,/shop/productdetails/337153/woolworths-cheese-roll
688724,Helga's Gluten Free 5 Seed Loaf 500g,$7.50,$1.50 / 100G,/shop/productdetails/688724/helga-s-gluten-free-5-seed-loaf
118611,Woolworths 7 Seeds & Grains Hi Fibre Low Gi Mini Loaf 370g,$2.50,$0.68 / 100G,/shop/productdetails/118611/woolworths-7-seeds-grains-hi-fibre-low-gi-mini-loaf
131381,Woolworths Lamingtons 6 Pack,$3.40,$1.13 / 100G,/shop/productdetails/131381/woolworths-lamingtons
55196,Woolworths Cake Chocolate Mud 585g,$6.40,$6.40 / 1EA,/shop/productdetails/55196/woolworths-cake-chocolate-mud
242149,Noshu Sugar Free Banana Bread 240g,$7.00,$2.92 / 100G,/shop/productdetails/242149/noshu-sugar-free-banana-bread
196100,Woolworths Traditional Fruited Bun 6 Pack,$4.00,$0.67 / 1EA,/shop/productdetails/196100/woolworths-traditional-fruited-bun
108376,Woolworths 35 Hour Sourdough Loaf Fruit & Seeds Each,$6.50,$6.50 / 1EA,/shop/productdetails/108376/woolworths-35-hour-sourdough-loaf-fruit-seeds
103123,Woolworths Free From Gluten Croissants 2 Pack,$5.50,$2.75 / 100G,/shop/productdetails/103123/woolworths-free-from-gluten-croissants
67700,Liberate Gluten Free Crumpets 4 Pack,$7.00,$2.92 / 100G,/shop/productdetails/67700/liberate-gluten-free-crumpets-240g-pk-4-liberate-gluten-free-crumpets
535769,Woolworths Custard Tart Large Each,$3.50,$3.50 / 1EA,/shop/productdetails/535769/woolworths-custard-tart-large
816101,Woolworths Free From Gluten Eng Muffins 4 Pack,$7.00,$2.50 / 100G,/shop/productdetails/816101/woolworths-free-from-gluten-eng-muffins
706502,Woolworths Chocolate & Hazelnut Mousse Slice 2 Pack,$5.50,$2.75 / 100G,/shop/productdetails/706502/woolworths-chocolate-hazelnut-mousse-slice
861012,Noshu 97% Sugar Free Iced Funtella Cakes 180g,$7.00,$3.89 / 100G,/shop/productdetails/861012/noshu-97-sugar-free-iced-funtella-cakes
658478,Bill's Health Bakery Multifruit Sourdough Loaf 660g,$8.50,$1.29 / 100G,/shop/productdetails/658478/bill-s-health-bakery-multifruit-sourdough-loaf
767976,Woolworths Quiche Lorraine Chilled Meal 700g,$14.00,$2.00 / 100G,/shop/productdetails/767976/woolworths-quiche-lorraine-chilled-meal
187387,Woolworths Extra Soft Spicy Fruit Loaf 680g,$3.00,$0.44 / 100G,/shop/productdetails/187387/woolworths-extra-soft-spicy-fruit-loaf
283400,Bfree Low Carb High Protein Wraps 5 Pack,$8.00,$3.81 / 100G,/shop/productdetails/283400/bfree-low-carb-high-protein-wraps
586414,Toscano Chocolate Truffle 450g,$9.50,$2.11 / 100G,/shop/productdetails/586414/toscano-chocolate-truffle
72553,Noshu Birthday Cake Donut 45g,$4.00,$8.89 / 100G,/shop/productdetails/72553/noshu-birthday-cake-donut
200380,Woolworths Free From Gluten Bake At Home White Dinner Rolls 4 Pack,$4.00,$1.00 / 1EA,/shop/productdetails/200380/woolworths-free-from-gluten-bake-at-home-white-dinner-rolls
221345,Helga's Prebiotic Ancient Grains & Seeds 700g,$5.50,$0.79 / 100G,/shop/productdetails/221345/helga-s-prebiotic-ancient-grains-seeds
40297,Woolworths Jam Filled Donuts 4 Pack,$4.75,$1.19 / 1EA,/shop/productdetails/40297/woolworths-jam-filled-donuts
254546,Woolworths Birthday Cake Mudcake 600g,$6.40,$1.07 / 100G,/shop/productdetails/254546/woolworths-birthday-cake-mudcake
633063,Cadbury Chocolate Cake Bars 5 Pack,$6.00,$1.20 / 1EA,/shop/productdetails/633063/cadbury-chocolate-cake-bars
705467,Woolworths Vanilla Cupcakes With Buttercream Frosting 9 Pack,$9.00,$1.00 / 1EA,/shop/productdetails/705467/woolworths-vanilla-cupcakes-with-buttercream-frosting
852359,Woolworths New York Style Cheesecake 2 Pack,$5.50,$2.50 / 100G,/shop/productdetails/852359/woolworths-new-york-style-cheesecake
633064,Cadbury Caramel Cake Bars 5 Pack,$6.00,$1.20 / 1EA,/shop/productdetails/633064/cadbury-caramel-cake-bars
677742,Noshu 97% Sugar Free Strawberry Donut 45g,$4.00,$8.89 / 100G,/shop/productdetails/677742/noshu-97-sugar-free-strawberry-donut
610474,Ham & Cheese Croissant 2 Pack,$3.40,$1.70 / 1EA,/shop/productdetails/610474/ham-cheese-croissant-2pk-ham-cheese-croissant
103358,Woolworths Traditional Carrot Cake 450g,$7.80,$1.73 / 100G,/shop/productdetails/103358/woolworths-traditional-carrot-cake
513901,Woolworths Dark Fruit Cake 465g,$4.50,$0.97 / 100G,/shop/productdetails/513901/woolworths-dark-fruit-cake
55049,Woolworths Plantitude Vegan Belgian Dark Chocolate Brownie 250g,$7.00,$2.80 / 100G,/shop/productdetails/55049/woolworths-plantitude-vegan-belgian-dark-chocolate-brownie
535646,Abbott's Bakery Gluten Free Soy & Linseed Sandwich Slice Bread Loaf 500g,$7.80,$1.56 / 100G,/shop/productdetails/535646/abbott-s-bakery-gluten-free-soy-linseed-sandwich-slice-bread-loaf
126429,Pane Di Casa Seeded Loaf Each,$5.00,$5.00 / 1EA,/shop/productdetails/126429/pane-di-casa-seeded-loaf
40291,Woolworths Caramel Iced Donuts 4 Pack,$4.75,$1.19 / 1EA,/shop/productdetails/40291/woolworths-caramel-iced-donuts
706493,Woolworths Lemon Cheesecake 2 Pack,$4.30,$2.39 / 100G,/shop/productdetails/706493/woolworths-lemon-cheesecake
9232,Custard Filled Profiterole 8 Pack,$6.75,$0.84 / 1EA,/shop/productdetails/9232/woolworths-custard-filled-profiterole
733768,Woolworths Apple Turnover With Fresh Cream Each,$5.00,$5.00 / 1EA,/shop/productdetails/733768/woolworths-apple-turnover-with-fresh-cream
940815,Noshu 97% Sugar Free Caramel Spice Donut 45g,$4.00,$8.89 / 100G,/shop/productdetails/940815/noshu-97-sugar-free-caramel-spice-donut
72082,Noshu 98% Sugar Free White Choc & Raspberry Blondie Slices 180g,$7.00,$3.89 / 100G,/shop/productdetails/72082/noshu-98-sugar-free-white-choc-raspberry-blondie-slices
256236,Woolworths Meringues Vanilla Minis 100g,$4.00,$4.00 / 100G,/shop/productdetails/256236/woolworths-meringues-vanilla-minis
803698,Brioche Gourmet Sliced Loaf 500g,$8.80,$1.76 / 100G,/shop/productdetails/803698/brioche-gourmet-sliced-loaf
513900,Woolworths Light Fruit Cake 465g,$4.50,$0.97 / 100G,/shop/productdetails/513900/woolworths-light-fruit-cake
787587,Woolworths Ginger Kisses 8 Pack,$4.90,$2.45 / 100G,/shop/productdetails/787587/woolworths-ginger-kisses
698110,Woolworths Belgian Chocolate Brownie 300g,$7.00,$2.33 / 100G,/shop/productdetails/698110/woolworths-belgian-chocolate-brownie
88602,Balconi Mix Max Spgnckes Cocoa 10 Pack,$7.25,$0.73 / 1EA,/shop/productdetails/88602/balconi-mix-max-spgnckes-cocoa
821560,Woolworths Free From Gluten Pizza Base 190g,$6.00,$3.16 / 100G,/shop/productdetails/821560/woolworths-free-from-gluten-pizza-base
58179,Mr Kipling French Fancies 8 Pack,$4.50,$0.56 / 1EA,/shop/productdetails/58179/mr-kipling-french-fancies
103356,Woolworths Indulgent Chocolate & Caramel Cake 400g,$7.80,$1.95 / 100G,/shop/productdetails/103356/woolworths-indulgent-chocolate-caramel-cake
285313,Bfree Wholegrain Wraps 5 Pack,$8.00,$3.81 / 100G,/shop/productdetails/285313/bfree-wholegrain-wraps
221503,Helga's Prebiotic Wholemeal & Barley 700g,$5.50,$0.79 / 100G,/shop/productdetails/221503/helga-s-prebiotic-wholemeal-barley
852474,Bare Bakers Choc Brownie 270g,$7.00,$2.59 / 100G,/shop/productdetails/852474/bare-bakers-choc-brownie
27078,Woolworths Mini Dessert Selection 20 Pack,N/A,N/A,/shop/productdetails/27078/woolworths-mini-dessert-selection
298548,Abe's Bagels Brioche Bagels 4 Pack,N/A,N/A,/shop/productdetails/298548/abe-s-bagels-brioche-bagels
117701,Krispy Kreme Assorted Doughnuts 9 Pack,$25.00,$25.00 / 1EA,/shop/productdetails/117701/krispy-kreme-assorted-doughnuts
215127,Bakery Du Jour Sliced Brioche Loaf 450g,N/A,N/A,/shop/productdetails/215127/bakery-du-jour-sliced-brioche-loaf
852475,Bare Bakers Salted Caramel Choc Brownie 270g,$7.00,$2.59 / 100G,/shop/productdetails/852475/bare-bakers-salted-caramel-choc-brownie
91895,Woolworths Pavlova Base Each,$9.20,$9.20 / 1EA,/shop/productdetails/91895/woolworths-pavlova-base
118607,Woolworths White Hi Fibre Low Gi Mini Loaf 340g,$2.50,$0.74 / 100G,/shop/productdetails/118607/woolworths-white-hi-fibre-low-gi-mini-loaf
256234,Woolworths Meringue Nests 10 Pack,N/A,N/A,/shop/productdetails/256234/woolworths-meringue-nests
103819,Bbq Meat Lovers Pizza 2 Pack,$3.40,$1.70 / 1EA,/shop/productdetails/103819/bbq-meat-lovers-pizza
855750,Cadbury Raspberry Mini Rolls Mini Rolls 5 Pack,$6.00,$1.20 / 1EA,/shop/productdetails/855750/cadbury-raspberry-mini-rolls-mini-rolls
58240,Petite Maison French Macarons 24 Pack,$21.00,$7.29 / 100G,/shop/productdetails/58240/petite-maison-french-macarons
55213,Mr Brownie Chocolate Brownie 200g,$6.00,$3.00 / 100G,/shop/productdetails/55213/mr-brownie-chocolate-brownie
62036,Woolworths Chocolate Birthday Drip Cake 1.5kg,$29.00,$1.93 / 100G,/shop/productdetails/62036/woolworths-chocolate-birthday-drip-cake
94463,Fry's 100% Vegan Brioche Burger Buns 4 Pack,$6.50,$2.60 / 100G,/shop/productdetails/94463/frys-100-vegan-brioche-burger-buns
510737,Woolworths Orange & Poppy Seed Cake 300g,$5.00,$1.67 / 100G,/shop/productdetails/510737/woolworths-orange-poppy-seed-cake
62033,Woolworths Rainbow Layer Cake 1kg,$29.00,$2.90 / 100G,/shop/productdetails/62033/woolworths-rainbow-layer-cake
103357,Woolworths Zesty Lemon Cake 400g,$7.80,$1.95 / 100G,/shop/productdetails/103357/woolworths-zesty-lemon-cake
727192,Woolworths Apple Crumble Tart 800g,$9.00,$1.13 / 100G,/shop/productdetails/727192/woolworths-apple-crumble-tart
118856,Krispy Kreme Original Glazed Doughnuts 3 Pack,$9.00,$9.00 / 1EA,/shop/productdetails/118856/krispy-kreme-original-glazed-doughnuts
116913,Krispy Kreme Original Glazed Doughnuts 9 Pack,$21.00,$21.00 / 1EA,/shop/productdetails/116913/krispy-kreme-original-glazed-doughnuts
94441,Woolworths Pastry Flan Case 150g,$3.50,$2.33 / 100G,/shop/productdetails/94441/woolworths-pastry-flan-case
162622,Woolworths Beef Mince & Rich Gravy Pastry Chilled Meal 700g,$11.50,$1.64 / 100G,/shop/productdetails/162622/woolworths-beef-mince-rich-gravy-pastry-chilled-meal
78581,Mr Cake Lemon Cakes 8 Pack,$6.00,$3.00 / 100G,/shop/productdetails/78581/mr-cake-lemon-cake-8pk-200g-mr-cake-lemon-cakes
743671,Cadbury Mint Mini Rolls 5 Pack,$6.00,$1.20 / 1EA,/shop/productdetails/743671/cadbury-mint-mini-rolls
182606,Noshu 98% Sugar Free Rich Chocolate Cake Mix 450g,$6.50,$1.44 / 100G,/shop/productdetails/182606/noshu-98-sugar-free-rich-chocolate-cake-mix
121999,Mini Pane Di Casa Plain Loaf Each,$3.00,$3.00 / 1EA,/shop/productdetails/121999/wow-mini-pane-di-casa-plain-loaf
143989,Woolworths Carrot Cake 1.5kg,$29.00,$1.93 / 100G,/shop/productdetails/143989/woolworths-carrot-cake
289456,Abbott's Bakery Sourdough White 760g,$4.60,$0.61 / 100G,/shop/productdetails/289456/abbott-s-bakery-sourdough-white
72382,Woolworths Black Forest Gateau Cake 1.4kg,$29.00,$2.07 / 100G,/shop/productdetails/72382/woolworths-black-forest-gateau-cake
921672,Woolworths Carrot Loaf 540g,$5.60,$1.04 / 100G,/shop/productdetails/921672/woolworths-carrot-loaf
77331,Dollar Sweets Happy Birthday Silver Cake Topper Each,$3.00,$3.00 / 1EA,/shop/productdetails/77331/dollar-sweets-happy-birthday-silver-cake-topper
77840,Mr Cake Cinnamon Crumb Cakes 8 Pack,$6.00,$3.00 / 100G,/shop/productdetails/77840/mr-cake-cinnamon-cake-8pk-200g-mr-cake-cinnamon-crumb-cakes
306659,Soy & Linseed Panini Roll 3 Pack,$3.50,$1.17 / 1EA,/shop/productdetails/306659/soy-linseed-panini-roll
291058,Toscano French Crepes Strawberry Filled 6 Pack,N/A,N/A,/shop/productdetails/291058/toscano-french-crepes-strawberry-filled
610477,Woolworths Pain Au Chocolate 2 Pack,$3.40,$1.70 / 1EA,/shop/productdetails/610477/woolworths-pain-au-chocolate
808590,Woolworths Free From Gluten Apple Pie 750g,$13.00,$1.73 / 100G,/shop/productdetails/808590/woolworths-free-from-gluten-apple-pie
629516,Sara Lee White Chocolate Cheesecake 760g,$14.00,$1.84 / 100G,/shop/productdetails/629516/sara-lee-white-chocolate-cheesecake
165040,Woolworths Pavlova Decorated Fresh Cream Each,$13.50,$13.50 / 1EA,/shop/productdetails/165040/woolworths-pavlova-decorated-fresh-cream
347787,Cakemark Cookies Coconut Macaroons 6 Pack 200g,$4.00,$2.00 / 100G,/shop/productdetails/347787/cakemark-cookies-coconut-macaroons
103359,Woolworths Fully Loaded Chocolate Brownie Cheesecake 900g,$22.00,$2.44 / 100G,/shop/productdetails/103359/woolworths-fully-loaded-chocolate-brownie-cheesecake
222681,Miguel Maestre Sticky Date Pudding 2 Pack,$10.00,$2.22 / 100G,/shop/productdetails/222681/miguel-maestre-sticky-date-pudding
286360,Choclt Red Velvet Brownie 2 Pack,N/A,N/A,/shop/productdetails/286360/choclt-red-velvet-brownie
223196,Miguel Maestre Whole Orange Syrup Cake 2 Pack,$10.00,$2.50 / 100G,/shop/productdetails/223196/miguel-maestre-whole-orange-syrup-cake
289416,Choclt Caramel Biscuit Cheesecake Pie 450g,N/A,N/A,/shop/productdetails/289416/choclt-caramel-biscuit-cheesecake-pie
449000,Sara Lee Baked Cheesecake Chocolate Ganache 760g,$14.00,$1.84 / 100G,/shop/productdetails/449000/sara-lee-baked-cheesecake-chocolate-ganache
272125,Bakery Du Jour Pain Au Choclat 4 Pack,N/A,N/A,/shop/productdetails/272125/bakery-du-jour-pain-au-choclat
159780,Woolworths Sponge Fresh Cream & Jam Cake Each,N/A,N/A,/shop/productdetails/159780/woolworths-sponge-fresh-cream-jam-cake
297150,Toscano Brioche English Muffins Classic 5 Pack,N/A,N/A,/shop/productdetails/297150/toscano-brioche-english-muffins-classic
242402,Woolworths 7 Seeds Hi Fibre Low Gi Rolls 4 Pack,N/A,N/A,/shop/productdetails/242402/woolworths-7-seeds-hi-fibre-low-gi-rolls
283417,Woolworths Funfetti Cookies 24 Pack,N/A,N/A,/shop/productdetails/283417/woolworths-funfetti-cookies
283418,Woolworths Oatmeal & Raisin Cookies 5 Pack,N/A,N/A,/shop/productdetails/283418/woolworths-oatmeal-raisin-cookies
242403,Woolworths White Hi Fibre Low Gi White Rolls 4 Pack,N/A,N/A,/shop/productdetails/242403/woolworths-white-hi-fibre-low-gi-white-rolls
