658779,Mission Wraps Low Carb 288g 6 Pack,$5.50,$1.91 / 100G,/shop/productdetails/658779/mission-wraps-low-carb
16436,Mountain Bread Rye Wraps 200g,$4.50,$2.25 / 100G,/shop/productdetails/16436/mountain-bread-rye-wraps
581174,Woolworths White Soft Toast Bread 650g,$2.70,$0.42 / 100G,/shop/productdetails/581174/woolworths-white-soft-toast-bread
27806,Woolworths Bread Rolls Soft Wholemeal Lunch 6 Pack,$2.50,$0.42 / 1EA,/shop/productdetails/27806/woolworths-bread-rolls-soft-wholemeal-lunch
581281,Woolworths Wholemeal Sandwich Hi-fibre Bread 700g,$3.50,$0.50 / 100G,/shop/productdetails/581281/woolworths-wholemeal-sandwich-hi-fibre-bread
706501,Woolworths Creamy Vanilla Slice 2 Pack,$5.50,$2.04 / 100G,/shop/productdetails/706501/woolworths-creamy-vanilla-slice
49622,Golden Crumpets Round 6 Pack,$4.40,$0.73 / 1EA,/shop/productdetails/49622/golden-crumpets-round
13044,Mighty Soft Bread Rolls Hamburger Buns 6 Pack,$3.70,$0.62 / 1EA,/shop/productdetails/13044/mighty-soft-bread-rolls-hamburger-buns
97077,Crafted Range Of Sourdough White Loaf Each,$7.00,$7.00 / 1EA,/shop/productdetails/97077/crafted-range-of-sourdough-white-loaf
84129,Helga's Bread Traditional Wholemeal 750g,$4.90,$0.65 / 100G,/shop/productdetails/84129/helga-s-bread-traditional-wholemeal
97078,Crafted Range Of Sourdough Dark Rye Loaf Each,$7.00,$7.00 / 1EA,/shop/productdetails/97078/crafted-range-of-sourdough-dark-rye-loaf
236288,Mighty Soft Raisin Toast 600g,$3.25,$0.54 / 100G,/shop/productdetails/236288/mighty-soft-raisin-toast
33908,Woolworths Bread Rolls Crusty Lunch 6 Pack,$2.50,$0.42 / 1EA,/shop/productdetails/33908/woolworths-bread-rolls-crusty-lunch
118406,Mountain Bread Natural Light Wraps 8 Pack,$4.50,$2.25 / 100G,/shop/productdetails/118406/mountain-bread-natural-light-wraps
46795,Tip Top English Muffins Original 6 Pack,$4.00,$0.67 / 1EA,/shop/productdetails/46795/tip-top-english-muffins-original
197276,Tip Top 9 Grain Original Low Gi Sandwich Slice Bread Loaf 700g,$4.40,$0.63 / 100G,/shop/productdetails/197276/tip-top-9-grain-original-low-gi-sandwich-slice-bread-loaf
26162,Mighty Soft Bread Rolls Hot Dog 6 Pack,$3.70,$0.62 / 1EA,/shop/productdetails/26162/mighty-soft-bread-rolls-hot-dog
298121,Woolworths Bread Rolls Bacon & Cheese 6 Pack,$6.00,$1.00 / 1EA,/shop/productdetails/298121/woolworths-bread-rolls-bacon-cheese
757540,Woolworths Jumbo Tiger Rolls 6 Pack,$3.00,$0.50 / 1EA,/shop/productdetails/757540/woolworths-jumbo-tiger-rolls
476143,Toscano Waffles Choc Chip 360g,$7.50,$2.08 / 100G,/shop/productdetails/476143/toscano-waffles-choc-chip
693170,Toscano Mini Waffle 200g,N/A,N/A,/shop/productdetails/693170/toscano-mini-waffle
165219,Tip Top White Bread Rolls Hamburger Buns 6 Pack,$4.50,$0.75 / 1EA,/shop/productdetails/165219/tip-top-white-bread-rolls-hamburger-buns
581170,Essentials White Sandwich Bread 650g,$2.40,$0.37 / 100G,/shop/productdetails/581170/essentials-white-sandwich-bread
116569,35hr Sourdough Mini Loaf White Each,$3.20,$3.20 / 1EA,/shop/productdetails/116569/35hr-sourdough-mini-loaf-white
177677,Mission Souvlaki Bread 320g,$4.00,$1.25 / 100G,/shop/productdetails/177677/mission-souvlaki-bread
33593,Woolworths All Butter Croissants 4 Pack,$2.85,$0.71 / 1EA,/shop/productdetails/33593/woolworths-all-butter-croissants
573301,Menissez Bake At Home White Dinner Rolls 6 Pack,$2.60,$0.43 / 1EA,/shop/productdetails/573301/menissez-bake-at-home-white-dinner-rolls
154927,Woolworths Crusty Vienna Loaf 450g,$3.00,$3.00 / 1EA,/shop/productdetails/154927/woolworths-crusty-vienna-loaf
240364,Helga's Wholemeal Lower Carb Wraps 6 Pack,$5.00,$1.85 / 100G,/shop/productdetails/240364/helga-s-wholemeal-lower-carb-wraps
331602,Abbott's Bakery Light Rye Sandwich Slice Bread Loaf 680g,$4.90,$0.72 / 100G,/shop/productdetails/331602/abbott-s-bakery-light-rye-sandwich-slice-bread-loaf
30718,Woolworths Bread Rolls Grain Lunch 6 Pack,$2.50,$0.42 / 1EA,/shop/productdetails/30718/woolworths-bread-rolls-grain-lunch
86566,Woolworths Jam Sponge Roll 400g,$3.50,$0.88 / 100G,/shop/productdetails/86566/woolworths-jam-sponge-roll
66911,Tip Top Burger Thins Bread 6 Pack,$3.00,$1.50 / 100G,/shop/productdetails/66911/tip-top-burger-thins-bread
774126,Mission Pita Bread Pockets Wholemeal 420g,$4.40,$1.05 / 100G,/shop/productdetails/774126/mission-pita-bread-pockets-wholemeal
690672,Abbott's Bakery Rustic White Sandwich Slice Bread Loaf 700g,$4.90,$0.70 / 100G,/shop/productdetails/690672/abbott-s-bakery-rustic-white-sandwich-slice-bread-loaf
322759,Sonoma Country White Sourdough 640g,$8.00,$1.25 / 100G,/shop/productdetails/322759/sonoma-country-white-sourdough
116759,Woolworths Sourdough Rolls White 3 Pack,$3.50,$1.17 / 1EA,/shop/productdetails/116759/sourdough-rolls-white
75238,Helga's Bread Light Rye 680g,$4.90,$0.72 / 100G,/shop/productdetails/75238/helga-s-bread-light-rye
328822,Woolworths Banana Bread Slices 5 Pack,$6.50,$1.30 / 100G,/shop/productdetails/328822/woolworths-banana-bread-slices
581178,Woolworths Multigrain Soft Sandwich Bread 650g,$2.70,$0.42 / 100G,/shop/productdetails/581178/woolworths-multigrain-soft-sandwich-bread
253303,Woolworths Bread Rolls Soft Wholemeal Jumbo 6 Pack,$3.00,$0.50 / 1EA,/shop/productdetails/253303/woolworths-bread-rolls-soft-wholemeal-jumbo
61227,Brioche Gourmet Brioche Sliders 10 Pack,$6.50,$0.65 / 1EA,/shop/productdetails/61227/brioche-gourmet-brioche-sliders
165306,Tip Top The One Gluten Free White Sandwich Slice Bread Loaf 550g,$7.00,$1.27 / 100G,/shop/productdetails/165306/tip-top-the-one-gluten-free-white-sandwich-slice-bread-loaf
331591,Abbott's Bakery Farmhouse Wholemeal Sandwich Slice Bread Loaf 750g,$4.90,$0.65 / 100G,/shop/productdetails/331591/abbott-s-bakery-farmhouse-wholemeal-sandwich-slice-bread-loaf
883004,Woolworths Mini Choc Chip Muffin 8 Pack,$4.70,$1.47 / 100G,/shop/productdetails/883004/woolworths-mini-choc-chip-muffin
202563,Woolworths Bread Rolls Crusty Jumbo Lunch 6 Pack,$3.00,$0.50 / 1EA,/shop/productdetails/202563/woolworths-bread-rolls-crusty-jumbo-lunch
86567,Woolworths Mini Jam Sponge Rolls 6 Pack,$3.50,$1.40 / 100G,/shop/productdetails/86567/woolworths-mini-jam-sponge-rolls
337151,Woolworths Bread Roll Cheese & Bacon 4 Pack,$4.50,$1.13 / 1EA,/shop/productdetails/337151/woolworths-bread-roll-cheese-bacon
224739,Woolworths Crumpets 6 Pack,$2.00,$0.33 / 1EA,/shop/productdetails/224739/woolworths-crumpets
202570,Woolworths Bread Rolls Crusty Jumbo Long 6 Pack,$3.00,$0.50 / 1EA,/shop/productdetails/202570/woolworths-bread-rolls-crusty-jumbo-long
279665,Woolworths Bread Loaf Crusty Tiger Tummy Vienna 450g,$3.00,$3.00 / 1EA,/shop/productdetails/279665/woolworths-bread-loaf-crusty-tiger-tummy-vienna
433887,Woolworths Country Loaf Wholemeal 750g,$3.90,$0.52 / 100G,/shop/productdetails/433887/woolworths-country-loaf-wholemeal
774123,Mission Pita Bread Pockets Plain 420g,$4.40,$1.05 / 100G,/shop/productdetails/774123/mission-pita-bread-pockets-plain
86569,Woolworths Mini Choc Sponge Rolls 6 Pack,$3.50,$1.40 / 100G,/shop/productdetails/86569/woolworths-mini-choc-sponge-rolls
720677,Woolworths Mini Bread Rolls Soft Hamburger 12 Pack,$4.50,$0.38 / 1EA,/shop/productdetails/720677/woolworths-mini-bread-rolls-soft-hamburger
89121,Tip Top English Muffins Wholemeal 6 Pack,$4.00,$0.67 / 1EA,/shop/productdetails/89121/tip-top-english-muffins-wholemeal
820588,Woolworths Free From Gluten White Wraps 4 Pack,$5.50,$2.75 / 100G,/shop/productdetails/820588/woolworths-free-from-gluten-white-wraps
650684,Nana Traditional Lebanese Bread Wholemeal 350g,$1.80,$0.51 / 100G,/shop/productdetails/650684/nana-traditional-lebanese-bread-wholemeal
165220,Tip Top Hot Dog Rolls 6 Pack,$4.50,$0.75 / 1EA,/shop/productdetails/165220/tip-top-hot-dog-rolls
686287,Woolworths Damper Rolls 6 Pack,$2.50,$0.42 / 1EA,/shop/productdetails/686287/woolworths-damper-rolls
408570,Essentials Fruit Toast 560g,$3.00,$0.54 / 100G,/shop/productdetails/408570/essentials-fruit-toast
31560,Golden Crumpets Round Wholemeal 6 Pack,$4.40,$0.73 / 1EA,/shop/productdetails/31560/golden-crumpets-round-wholemeal
7413,Golden Crumpet Squares 6 Pack,$3.50,$0.58 / 1EA,/shop/productdetails/7413/golden-crumpet-squares
572265,Woolworths Zucchini Slice Chilled Meal 700g,$13.50,$1.93 / 100G,/shop/productdetails/572265/woolworths-zucchini-slice-chilled-meal
55656,Woolworths Bread White Extra Soft Loaf 680g,$2.50,$0.37 / 100G,/shop/productdetails/55656/woolworths-bread-white-extra-soft-loaf
883002,Woolworths Mini Blueberry Muffins 8 Pack,$4.70,$1.47 / 100G,/shop/productdetails/883002/woolworths-mini-blueberry-muffins
258204,Tip Top Café Raisin Bread Thick 650g,$5.00,$0.77 / 100G,/shop/productdetails/258204/tip-top-caf-raisin-bread-thick
112315,Mountain Bread Rice Mountain Bread 200g,$4.50,$2.25 / 100G,/shop/productdetails/112315/mountain-bread-rice-mountain-bread
867246,Toscano Classic Pizza Bases 2 Pack,$5.80,$1.93 / 100G,/shop/productdetails/867246/toscano-classic-pizza-bases
363945,Woolworths 35hr Sourdough Loaf Kalamata Olive Each,$6.50,$6.50 / 1EA,/shop/productdetails/363945/woolworths-35hr-sourdough-loaf-kalamata-olive
95872,Helga's Grain Bread Mixed Grain 850g,$4.90,$0.58 / 100G,/shop/productdetails/95872/helga-s-grain-bread-mixed-grain
4378,Toscano Chocolate Croissants 6 Pack,$5.50,$0.92 / 1EA,/shop/productdetails/4378/toscano-chocolate-croissants
51639,Abbott's Bakery Dark Rye Sandwich Slice Bread Loaf 700g,$4.90,$0.70 / 100G,/shop/productdetails/51639/abbott-s-bakery-dark-rye-sandwich-slice-bread-loaf
97076,Crafted Range Of Sourdough Ancient Grains & Sprouted Seeds Miche Each,$7.00,$7.00 / 1EA,/shop/productdetails/97076/crafted-range-of-sourdough-ancient-grains-sprouted-seeds-miche
883116,Woolworths Mini Double Choc Muffins 8 Pack,$4.70,$1.47 / 100G,/shop/productdetails/883116/woolworths-mini-double-choc-muffins
650549,Nana Traditional Lebanese Bread White 350g,$1.80,$0.51 / 100G,/shop/productdetails/650549/nana-traditional-lebanese-bread-white
253306,Woolworths Bread Rolls Grain Jumbo 6 Pack,$3.00,$0.50 / 1EA,/shop/productdetails/253306/woolworths-bread-rolls-grain-jumbo
581280,Woolworths White Soft Hi-fibre Bread 700g,$3.50,$0.50 / 100G,/shop/productdetails/581280/woolworths-white-soft-hi-fibre-bread
218853,Tip Top Gourmet Burger Buns 4 Pack,$5.50,$2.50 / 100G,/shop/productdetails/218853/tip-top-gourmet-burger-buns
363949,Woolworths 35hr Sourdough Loaf Garlic & Olive Oil Loaf Each,$6.50,$6.50 / 1EA,/shop/productdetails/363949/woolworths-35hr-sourdough-loaf-garlic-olive-oil-loaf
97237,Woolworths All Butter Croissant 3 Pack,$2.85,$0.95 / 1EA,/shop/productdetails/97237/woolworths-all-butter-croissant
240473,Simson's Pantry Low Carb High Protein + Fibre Large Wraps 6 Pack,$6.50,$1.55 / 100G,/shop/productdetails/240473/simson-s-pantry-low-carb-high-protein-fibre-large-wraps
84128,Helga's Bread Traditional White 750g,$4.90,$0.65 / 100G,/shop/productdetails/84128/helga-s-bread-traditional-white
242695,White Panini Roll 3 Pack,$3.50,$3.50 / 1EA,/shop/productdetails/242695/white-panini-roll
116760,35hr Sourdough Mini Loaf Dark Rye Each,$3.20,$3.20 / 1EA,/shop/productdetails/116760/35hr-sourdough-mini-loaf-dark-rye
35496,Woolworths Bread Wholemeal Loaf 680g,$2.50,$0.37 / 100G,/shop/productdetails/35496/woolworths-bread-wholemeal-loaf
720678,Woolworths Mini Bread Rolls Soft Lunch 12 Pack,$4.50,$0.38 / 1EA,/shop/productdetails/720678/woolworths-mini-bread-rolls-soft-lunch
154935,Woolworths Crusty Baguette French Stick 340g,$1.90,$1.90 / 1EA,/shop/productdetails/154935/woolworths-crusty-baguette-french-stick
957684,Mighty Soft Fruit Loaf Cafe Style 600g,$7.00,$1.17 / 100G,/shop/productdetails/957684/mighty-soft-fruit-loaf-cafe-style
116746,Woolworths 35hr Sourdough Mini Loaf Seeded Each,$3.20,$3.20 / 1EA,/shop/productdetails/116746/35hr-sourdough-mini-loaf-seeded
97079,Crafted Range Of Sourdough Olive Loaf Each,$7.00,$7.00 / 1EA,/shop/productdetails/97079/crafted-range-of-sourdough-olive-loaf
131380,Woolworths Lamington Fingers 18 Pack,$3.40,$0.97 / 100G,/shop/productdetails/131380/woolworths-lamington-fingers
856990,Tip Top Pizza Bases White 12 Inch 2 Pack,$4.00,$0.91 / 100G,/shop/productdetails/856990/tip-top-pizza-bases-white-12-inch
38214,Woolworths Fresh Donuts Cinnamon 12 Pack,$3.50,$0.29 / 1EA,/shop/productdetails/38214/woolworths-fresh-donuts-cinnamon
233162,Woolworths Bread Wholemeal Soft Loaf 800g,$3.50,$0.44 / 100G,/shop/productdetails/233162/woolworths-bread-wholemeal-soft-loaf
645865,Bakery Du Jour Brioche Burger Buns 4 Pack,$3.30,$0.83 / 1EA,/shop/productdetails/645865/bakery-du-jour-brioche-burger-buns
607875,Woolworths Mini Banana Muffin 8 Pack,$4.70,$1.47 / 100G,/shop/productdetails/607875/woolworths-mini-banana-muffin
240582,Helga's Sweet Potato Wraps 7 Pack,$5.00,$1.12 / 100G,/shop/productdetails/240582/helga-s-sweet-potato-wraps
586264,Toscano Tiramisu 500g,$9.50,$1.90 / 100G,/shop/productdetails/586264/toscano-tiramisu
827400,Toscano Gluten Free Pizza Base 180g,$6.50,$3.61 / 100G,/shop/productdetails/827400/toscano-gluten-free-pizza-base
663230,Woolworths Mixed Tarts 6 Pack,$3.75,$0.63 / 1EA,/shop/productdetails/663230/woolworths-mixed-tarts
365378,Woolworths Pikelets 8 Pack,$2.80,$0.35 / 1EA,/shop/productdetails/365378/woolworths-pikelets
322760,Sonoma Whole Wheat Miche 605g,$8.00,$1.32 / 100G,/shop/productdetails/322760/sonoma-whole-wheat-miche
421465,Woolworths Dreamy Chocolate Chip Cookies 5 Pack,$3.00,$0.60 / 1EA,/shop/productdetails/421465/woolworths-dreamy-chocolate-chip-cookies
232832,Burgen Rye Low Gi Sliced Bread Loaf 700g,$5.90,$0.84 / 100G,/shop/productdetails/232832/burgen-rye-low-gi-sliced-bread-loaf
684682,Toscano French Croissants 240g X6 Pack,N/A,N/A,/shop/productdetails/684682/toscano-french-croissants
73199,Woolworths Caramel Slices 4 Pack,$4.30,$2.15 / 100G,/shop/productdetails/73199/woolworths-caramel-slices
116747,Woolworths Sourdough Rolls Seeded 3 Pack,$3.50,$1.17 / 1EA,/shop/productdetails/116747/sourdough-rolls-seeded
239786,Helga's Corn Tortilla Wraps 8 Pack,$5.00,$0.98 / 100G,/shop/productdetails/239786/helga-s-corn-tortilla-wraps
233160,Woolworths Bread White Extra Soft Loaf 800g,$3.50,$0.44 / 100G,/shop/productdetails/233160/woolworths-bread-white-extra-soft-loaf
948485,Home Chef Quiche Lorraine Chilled Meal 700g,$9.00,$1.29 / 100G,/shop/productdetails/948485/home-chef-quiche-lorraine-chilled-meal
263634,Tip Top 9 Grain Plus Wholemeal 750g,$4.40,$0.59 / 100G,/shop/productdetails/263634/tip-top-9-grain-plus-wholemeal
260722,Woolworths Double Unfilled Sponge 460g,$6.00,$1.30 / 100G,/shop/productdetails/260722/woolworths-double-unfilled-sponge
690125,Abbott's Bakery Country Grains Sandwich Slice Bread Loaf 800g,$4.90,$0.61 / 100G,/shop/productdetails/690125/abbott-s-bakery-country-grains-sandwich-slice-bread-loaf
763317,Home Chef Quiche Spinach & Feta Chilled Meal 700g,$9.00,$1.29 / 100G,/shop/productdetails/763317/home-chef-quiche-spinach-feta-chilled-meal
240436,Simson's Pantry Low Carb Keto Friendly Wraps 5 Pack,$6.00,$3.00 / 100G,/shop/productdetails/240436/simson-s-pantry-low-carb-keto-friendly-wraps
89471,Woolworths Thin Crust Pizza Base 2 Pack,$3.00,$1.50 / 100G,/shop/productdetails/89471/woolworths-thin-crust-pizza-base
720679,Woolworths Mini Bread Rolls Soft Hot Dog 12 Pack,$4.50,$0.38 / 1EA,/shop/productdetails/720679/woolworths-mini-bread-rolls-soft-hot-dog
709014,Toscano Chocolate Filled Crepes 192g,$6.00,$3.13 / 100G,/shop/productdetails/709014/toscano-chocolate-filled-crepes
679319,Toscano Pizza Bruschettina 270g,$4.80,$1.78 / 100G,/shop/productdetails/679319/toscano-pizza-bruschettina
247546,Toscano Belgian Liege Waffles Choc Coated 4 Pack,N/A,N/A,/shop/productdetails/247546/toscano-belgian-liege-waffles-choc-coated
489783,Bfree 5 Wraps Sweet Potato 210g,$8.00,$3.81 / 100G,/shop/productdetails/489783/bfree-5-wraps-sweet-potato
250627,Woolworths Cookies Choc Chip 24 Pack,$5.50,$0.23 / 1EA,/shop/productdetails/250627/woolworths-cookies-choc-chip
270580,Abe's Bagel Bakery Natural Bagels 360g 4 Pack,$5.00,$1.25 / 1EA,/shop/productdetails/270580/abe-s-bagel-bakery-natural-bagels
669044,Hedy's Fresh Quiche Spinach & Feta Chilled Meal 1.1kg,$14.50,$1.32 / 100G,/shop/productdetails/669044/hedy-s-fresh-quiche-spinach-feta-chilled-meal
708948,Toscano Classic Brioche Rolls 280g,$6.50,$2.32 / 100G,/shop/productdetails/708948/toscano-classic-brioche-rolls
581054,Home Chef Quiche Lorraine Chilled Meal 200g,$5.00,$2.50 / 100G,/shop/productdetails/581054/home-chef-quiche-lorraine-chilled-meal
217401,Tip Top Potato Burger Buns 4 Pack,$5.50,$1.88 / 100G,/shop/productdetails/217401/tip-top-potato-burger-buns
218375,Tip Top The One Gluten Free Smooth Wholegrain Bread 550g,$7.00,$1.27 / 100G,/shop/productdetails/218375/tip-top-the-one-gluten-free-smooth-wholegrain-bread
678110,Toscano Tiramisu Twin 60g X2 Pack,$6.00,$5.00 / 100G,/shop/productdetails/678110/toscano-tiramisu-twin
251478,Woolworths Hawaiian Jumbo Roll 2 Pack,$3.40,$1.70 / 1EA,/shop/productdetails/251478/woolworths-hawaiian-jumbo-roll
856994,Tip Top Pizza Bases Wholemeal 12 Inch 2 Pack,$4.00,$0.91 / 100G,/shop/productdetails/856994/tip-top-pizza-bases-wholemeal-12-inch
154953,Woolworths Loaf Crusty Cobb 450g,$3.00,$3.00 / 1EA,/shop/productdetails/154953/woolworths-loaf-crusty-cobb
746874,Woolworths Loaf Pane Di Casa 520g,$5.00,$5.00 / 1EA,/shop/productdetails/746874/woolworths-loaf-pane-di-casa
803943,Brioche Gourmet Burger Buns 4 Pack,$6.50,$1.63 / 1EA,/shop/productdetails/803943/brioche-gourmet-burger-buns
157108,Woolworths Iced Finger Bun Extra Soft 4 Pack,$2.50,$0.63 / 1EA,/shop/productdetails/157108/woolworths-iced-finger-bun-extra-soft
370814,Helga's Pumpkin Seed & Grain 720g,$4.90,$0.68 / 100G,/shop/productdetails/370814/helga-s-pumpkin-seed-grain
883001,Woolworths Blueberry Muffins 4 Pack,$4.70,$1.12 / 100G,/shop/productdetails/883001/woolworths-blueberry-muffins
46645,Golden Pikelets 8 Pack,$4.50,$0.56 / 1EA,/shop/productdetails/46645/golden-pikelets
333359,Woolworths Mini Croissant 8 Pack,$4.00,$0.50 / 1EA,/shop/productdetails/333359/woolworths-mini-croissant
162880,Hedy's Fresh Quiche Lorraine Chilled Meal 1.1kg,$14.50,$1.32 / 100G,/shop/productdetails/162880/hedy-s-fresh-quiche-lorraine-chilled-meal
846809,Mr Kipling Cake Angel Slices Snack Pack 6 Pack,$5.00,$0.83 / 1EA,/shop/productdetails/846809/mr-kipling-cake-angel-slices-snack-pack
852253,Macro Linseed & Sunflower Low Carb Loaf 500g,$4.80,$0.96 / 100G,/shop/productdetails/852253/macro-linseed-sunflower-low-carb-loaf
581055,Home Chef Spinach & Feta Quiche Chilled Meal 200g,$5.00,$2.50 / 100G,/shop/productdetails/581055/home-chef-spinach-feta-quiche-chilled-meal
232833,Burgen Soy & Linseed Low Gi Sliced Bread Loaf 700g,$5.90,$0.84 / 100G,/shop/productdetails/232833/burgen-soy-linseed-low-gi-sliced-bread-loaf
66921,Large Butter Croissant 10 Pack,$9.00,$0.90 / 1EA,/shop/productdetails/66921/large-butter-croissant
781712,Woolworths Portuguese Tarts 4 Pack,$6.50,$1.63 / 1EA,/shop/productdetails/781712/woolworths-portuguese-tarts
366169,Woolworths Tiger Crusty Baguette 340g,$1.90,$1.90 / 1EA,/shop/productdetails/366169/woolworths-tiger-crusty-baguette
145667,Woolworths Anzac Biscuit Family 24 Pack,$5.50,$0.23 / 1EA,/shop/productdetails/145667/woolworths-anzac-biscuit-family
650689,Nana Premium Lebanese Bread Wholemeal 500g,$3.80,$0.76 / 100G,/shop/productdetails/650689/nana-premium-lebanese-bread-wholemeal
320381,Woolworths Cup Cake Mini Iced 9 Pack,$5.50,$0.61 / 1EA,/shop/productdetails/320381/woolworths-cup-cake-mini-iced
883003,Woolworths Choc Chip Muffin 4 Pack,$4.70,$1.12 / 100G,/shop/productdetails/883003/woolworths-choc-chip-muffin
185739,Woolworths Cookies Jam Drop 14 Pack,$3.50,$0.25 / 1EA,/shop/productdetails/185739/woolworths-cookies-jam-drop
709008,Toscano Chocolate Chip Brioche Rolls 280g,$6.50,$2.32 / 100G,/shop/productdetails/709008/toscano-chocolate-chip-brioche-rolls
824732,Woolworths Free From Gluten White Bread 550g,$6.25,$1.14 / 100G,/shop/productdetails/824732/woolworths-free-from-gluten-white-bread
75035,Helga's Wholemeal Bread With Grains 850g,$4.90,$0.58 / 100G,/shop/productdetails/75035/helga-s-wholemeal-bread-with-grains
240393,Helga's Prebiotic Wraps Large 6 Pack,$5.00,$1.31 / 100G,/shop/productdetails/240393/helga-s-prebiotic-wraps-large
253921,Burgen Wholemeal & Seeds Low Gi Sliced Bread Loaf 700g,$5.90,$0.84 / 100G,/shop/productdetails/253921/burgen-wholemeal-seeds-low-gi-sliced-bread-loaf
573302,Menissez Bake At Home Multigrain Dinner Rolls 6 Pack,$2.60,$0.43 / 1EA,/shop/productdetails/573302/menissez-bake-at-home-multigrain-dinner-rolls
698619,Woolworths Roasted Vegetable Quiche Chilled Meal 700g,$14.00,$2.00 / 100G,/shop/productdetails/698619/woolworths-roasted-vegetable-quiche-chilled-meal
118610,Woolworths 7 Seeds & Grains Hi Fibre Low Gi Loaf 750g,$3.70,$0.49 / 100G,/shop/productdetails/118610/woolworths-7-seeds-grains-hi-fibre-low-gi-loaf
650860,Nana Premium Lebanese Bread White 500g,$3.80,$0.76 / 100G,/shop/productdetails/650860/nana-premium-lebanese-bread-white
233155,Woolworths Bread Grain Loaf 800g,$3.50,$0.44 / 100G,/shop/productdetails/233155/woolworths-bread-grain-loaf
164022,Burgen Lower Carb High Protein Sunflower & Linseed Bread Loaf 660g,$6.00,$0.91 / 100G,/shop/productdetails/164022/burgen-lower-carb-high-protein-sunflower-linseed-bread-loaf
360222,Woolworths Mini Iced Cupcakes With Sprinkles 24 Pack,$11.00,$0.46 / 1EA,/shop/productdetails/360222/woolworths-mini-iced-cupcakes-with-sprinkles
803928,Brioche Gourmet Hot Dog Rolls 6 Pack,$6.50,$1.08 / 1EA,/shop/productdetails/803928/brioche-gourmet-hot-dog-rolls
650871,Nana Premium Pita Bread Wholemeal 5 Pack,$2.50,$1.00 / 100G,/shop/productdetails/650871/nana-premium-pita-bread-wholemeal
883005,Woolworths Double Choc Chip Muffin 4 Pack,$4.70,$1.12 / 100G,/shop/productdetails/883005/woolworths-double-choc-chip-muffin
236078,Wonder Soft White Gluten Free 470g,$7.00,$1.49 / 100G,/shop/productdetails/236078/wonder-soft-white-gluten-free
688719,Helga's Gluten Free Wholemeal Loaf 500g,$7.50,$1.50 / 100G,/shop/productdetails/688719/helga-s-gluten-free-wholemeal-loaf
453156,Cadbury Mini Rolls Chocolate 5 Pack,$6.00,$1.20 / 1EA,/shop/productdetails/453156/cadbury-mini-rolls-chocolate
684683,Toscano Mini Hot Dog Brioche Buns 6 Pack,N/A,N/A,/shop/productdetails/684683/toscano-mini-hot-dog-brioche-buns
854648,Toscano Macarons 144g,$10.50,$7.29 / 100G,/shop/productdetails/854648/toscano-macarons
796187,Turkish Bakeries Stone Baked Pizza Bases 2 Pack,$6.00,$1.33 / 100G,/shop/productdetails/796187/turkish-bakeries-stone-baked-pizza-bases
222270,Woolworths Plain Bagels 4 Pack,N/A,N/A,/shop/productdetails/222270/woolworths-plain-bagels
108491,Woolworths 35hr Sourdough Loaf Potato & Rosemary Each,$6.50,$6.50 / 1EA,/shop/productdetails/108491/woolworths-35hr-sourdough-loaf-potato-rosemary
824733,Woolworths Free From Gluten Seeded Bread 550g,$6.25,$1.14 / 100G,/shop/productdetails/824733/woolworths-free-from-gluten-seeded-bread
688815,Helga's Gluten Free Traditional White Loaf 470g,$7.50,$1.60 / 100G,/shop/productdetails/688815/helga-s-gluten-free-traditional-white-loaf
118609,Woolworths White Hi Fibre Low Gi Loaf 680g,$3.70,$0.54 / 100G,/shop/productdetails/118609/woolworths-white-hi-fibre-low-gi-loaf
517746,Mini Chocolate Croissant 8 Pack,$4.00,$0.50 / 1EA,/shop/productdetails/517746/mini-chocolate-croissant
607942,Mr Kipling Lemon Slice 6 Pack,$5.00,$0.83 / 1EA,/shop/productdetails/607942/mr-kipling-lemon-slice
125793,Brioche Gourmet Brioche Burger Buns With Seasame Seeds 4 Pack,$6.50,$1.63 / 1EA,/shop/productdetails/125793/brioche-gourmet-brioche-burger-buns-with-seasame-seeds
33140,Golden Pancakes 6 Pack 360g,$5.50,$1.53 / 100G,/shop/productdetails/33140/golden-pancakes
40283,Woolworths Chocolate Iced Donuts 4 Pack,$4.75,$1.19 / 1EA,/shop/productdetails/40283/woolworths-chocolate-iced-donuts
688779,Woolworths Lightly Fruited Cake 700g,$4.30,$0.61 / 100G,/shop/productdetails/688779/woolworths-lightly-fruited-cake
131482,Woolworths Jam Filled Lamingtons 6 Pack,$3.40,$0.97 / 100G,/shop/productdetails/131482/woolworths-jam-filled-lamingtons
883117,Woolworths Apple & Cinnamon Muffins 4 Pack,$4.70,$1.12 / 100G,/shop/productdetails/883117/woolworths-apple-cinnamon-muffins
86821,Woolworths Banana Muffin Bars 10 Pack,$5.25,$1.31 / 100G,/shop/productdetails/86821/woolworths-banana-muffin-bars
86820,Woolworths Double Choc Muffin Bars 10 Pack,$5.25,$1.31 / 100G,/shop/productdetails/86820/woolworths-double-choc-muffin-bars
186852,Woolworths Mud Cake White 600g,$6.40,$1.07 / 100G,/shop/productdetails/186852/woolworths-mud-cake-white
118172,Woolworths Party Pack Mud Cake Slices 24 Pack,$13.00,$1.30 / 100G,/shop/productdetails/118172/woolworths-party-pack-mud-cake-slices
512256,Woolworths Mini Mighty Cheese Pinwheel 8 Pack,$4.00,$0.50 / 1EA,/shop/productdetails/512256/woolworths-mini-mighty-cheese-pinwheel
921694,Woolworths Lemon Madeira Cake 315g,$3.30,$1.05 / 100G,/shop/productdetails/921694/woolworths-lemon-madeira-cake
61194,Woolworths Caramel Bar Slice 260g,$7.50,$2.88 / 100G,/shop/productdetails/61194/woolworths-caramel-bar-slice
802845,Lawson's Settlers Grain Traditional Bread 750g,$5.80,$0.77 / 100G,/shop/productdetails/802845/lawson-s-settlers-grain-traditional-bread
921693,Woolworths Madeira Cake 450g,$3.30,$0.73 / 100G,/shop/productdetails/921693/woolworths-madeira-cake
573300,Menissez Bake At Home White Baguettes 2 Pack,N/A,N/A,/shop/productdetails/573300/menissez-bake-at-home-white-baguettes
678120,Toscano Double Choc Mousse Twin 60g X2 Pack,$6.00,$5.00 / 100G,/shop/productdetails/678120/toscano-double-choc-mousse-twin
237031,Wonder Gluten Free Wholemeal Bread 500g,$7.00,$1.40 / 100G,/shop/productdetails/237031/wonder-gluten-free-wholemeal-bread
140173,Woolworths Soft & Glazed Milk Buns 4 Pack,N/A,N/A,/shop/productdetails/140173/woolworths-soft-glazed-milk-buns
164942,Noshu 95% Sugar Free Iced Carrot Cake 4 Slices 180g,$7.00,$3.89 / 100G,/shop/productdetails/164942/noshu-95-sugar-free-iced-carrot-cake-4-slices
57631,Bfree Pita Pockets 6 Pack,$7.00,$3.65 / 100G,/shop/productdetails/57631/bfree-pita-pockets
