2271188,Coles RSPCA Approved Whole Chicken Roast | 1 each,$12.00,https://www.coles.com.au/product/coles-rspca-approved-whole-chicken-roast-1-each-2271188
6303050,Primo Manuka Honey Bacon | 175g,$6.15,https://www.coles.com.au/product/primo-manuka-honey-bacon-175g-6303050
6303027,Primo Australian Made Middle Bacon | 200g,$7.00,https://www.coles.com.au/product/primo-australian-made-middle-bacon-200g-6303027
6286992,Primo Australian Short Cut Bacon | 200g,$7.00,https://www.coles.com.au/product/primo-australian-short-cut-bacon-200g-6286992
2271199,Coles Deli RSPCA Approved Chicken Breast Fil ... approx 300g,$3.30,https://www.coles.com.au/product/coles-deli-rspca-approved-chicken-breast-fillets-approx.-300g-each-2271199
4222321,Primo Champagne Ham From the Deli | approx 100g,$2.20,https://www.coles.com.au/product/primo-champagne-ham-from-the-deli-approx.-100g-4222321
8106800,Coles Deli Fresh Tasmanian Salmon Portions ... approx 200g,$5.80,https://www.coles.com.au/product/coles-deli-fresh-tasmanian-salmon-portions-skin-on-approx.-200g-8106800
4304255,Primo Middle Bacon Rind On | approx 100g,$1.28,https://www.coles.com.au/product/primo-middle-bacon-rind-on-approx.-100g-4304255
9358230,Don Deli Melosi Leg Ham | approx 100g,$3.10,https://www.coles.com.au/product/don-deli-melosi-leg-ham-approx.-100g-9358230
5185446,Don White Hungarian Salami | approx 100g,$2.95,https://www.coles.com.au/product/don-white-hungarian-salami-approx.-100g-5185446
4304277,Primo Short Cut Bacon | approx 250g,$4.50,https://www.coles.com.au/product/primo-short-cut-bacon-approx.-250g-4304277
3954674,Coles Deli Thawed Raw Black Tiger Prawns | approx 250g,$7.25,https://www.coles.com.au/product/coles-deli-thawed-raw-black-tiger-prawns-approx.-250g-3954674
3052929,Don Virginian Leg Ham Sliced | approx 100g,$2.10,https://www.coles.com.au/product/don-virginian-leg-ham-sliced-approx.-100g-3052929
2076604,Coles Deli Don Kabana | 1 each,$3.30,https://www.coles.com.au/product/coles-deli-don-kabana-1-each-2076604
2272657,Coles Deli RSPCA Approved Chicken Thigh Fillets | approx 150g,$2.02,https://www.coles.com.au/product/coles-deli-rspca-approved-chicken-thigh-fillets-approx.-150g-each-2272657
7103680,Bertocchi Natural Hickory Smoked Leg Ham | approx 100g,$2.50,https://www.coles.com.au/product/bertocchi-natural-hickory-smoked-leg-ham-approx.-100g-7103680
3944524,Coles Deli Thawed Raw Peeled Prawn Meat | approx 250g,$7.00,https://www.coles.com.au/product/coles-deli-thawed-raw-peeled-prawn-meat-approx.-250g-3944524
5342715,Lilydale Chicken Sage & Onion Roast | 1 each,$13.00,https://www.coles.com.au/product/lilydale-chicken-sage-and-onion-roast-1-each-5342715
2157397,Coles Deli Thawed Arrow Squid Rings | approx 250g,$1.75,https://www.coles.com.au/product/coles-deli-thawed-arrow-squid-rings-approx.-250g-2157397
3052601,Primo Deli Express Chicken Frankfurt | 750g,$7.40,https://www.coles.com.au/product/primo-deli-express-chicken-frankfurt-750g-3052601
1890118,Bertocchi Triple Smoked Leg Ham | approx 100g,$2.95,https://www.coles.com.au/product/bertocchi-triple-smoked-leg-ham-approx.-100g-1890118
1015411,Coles Bacon Shortcut Rindless | 200g,$5.00,https://www.coles.com.au/product/coles-bacon-shortcut-rindless-200g-1015411
5505376,Coles Deli Hot Hungarian Don Salami | approx 100g,$2.95,https://www.coles.com.au/product/coles-deli-hot-hungarian-don-salami-approx.-100g-5505376
1015863,Coles Rindless Pan Sized Bacon | 200g,$5.00,https://www.coles.com.au/product/coles-rindless-pan-sized-bacon-200g-1015863
4377340,Coles Thawed Seafood Marinara Mix | approx 250g,$3.75,https://www.coles.com.au/product/coles-thawed-seafood-marinara-mix-approx.-250g-4377340
1202102,Steggles Roasted Turkey Breast From The Deli | approx 100g,$2.60,https://www.coles.com.au/product/steggles-roasted-turkey-breast-from-the-deli-approx.-100g-1202102
1976461,Coles Deli RSPCA Approved Chicken Breast Chunks | approx ... approx 250g,$2.50,https://www.coles.com.au/product/coles-deli-rspca-approved-chicken-breast-chunks-approx.-250g-1976461
1015615,Coles Bacon Streaky | 200g,$5.00,https://www.coles.com.au/product/coles-bacon-streaky-200g-1015615
9398755,Coles Deli Thawed Basa Fillets | approx 200g,$2.20,https://www.coles.com.au/product/coles-deli-thawed-basa-fillets-approx.-200g-each-9398755
8104860,Coles Deli Fresh Tasmanian Salmon Portions ... approx 250g,$9.00,https://www.coles.com.au/product/coles-deli-fresh-tasmanian-salmon-portions-skin-off-approx.-250g-8104860
8145856,Primo English Sliced Ham | 100g,$3.70,https://www.coles.com.au/product/primo-english-sliced-ham-100g-8145856
9586449,Coles Deli Thawed Barramundi Fillets | approx 350g,$6.65,https://www.coles.com.au/product/coles-deli-thawed-barramundi-fillets-approx.-350g-9586449
2260476,Thomson'S Deli English Style Ham Quad Pack | 400g,$5.50,https://www.coles.com.au/product/thomson's-deli-english-style-ham-quad-pack-400g-2260476
1472253,Coles Silverside | approx 100g,$2.50,https://www.coles.com.au/product/coles-silverside-approx.-100g-1472253
8836813,Coles Deli Thawed Australian MSC Raw Banana Prawns | approx ... approx 250g,$6.50,https://www.coles.com.au/product/coles-deli-thawed-australian-msc-raw-banana-prawns-approx.-250g-8836813
2271643,Coles Deli RSPCA Approved Chicken Drumstic ... approx 160g,$0.64,https://www.coles.com.au/product/coles-deli-rspca-approved-chicken-drumsticks-approx.-160g-2271643
2260465,Thomson's Deli Honey Ham Sliced Quad Pack | 400g,$5.50,https://www.coles.com.au/product/thomson's-deli-honey-ham-sliced-quad-pack-400g-2260465
328739,Don Skinless Thin Frankfurt's | approx 100g,$1.37,https://www.coles.com.au/product/don-skinless-thin-frankfurt's-approx.-100g-each-328739
4658349,Thomson's Deli Supreme Chicken Breast | approx 100g,$1.65,https://www.coles.com.au/product/thomson's-deli-supreme-chicken-breast-approx.-100g-4658349
6284567,Don Leg Shaved Ham | 200g,$6.40,https://www.coles.com.au/product/don-leg-shaved-ham-200g-6284567
3053353,Coles English Sliced Ham | 100g,$2.30,https://www.coles.com.au/product/coles-english-sliced-ham-100g-3053353
1067914,Coles Deli Fresh West Australian Barramundi Portions ... approx 200g,$6.50,https://www.coles.com.au/product/coles-deli-fresh-west-australian-barramundi-portions-skin-on-approx.-200g-1067914
2090081,Primo Spanish Style Chorizos | 1 each,$3.20,https://www.coles.com.au/product/primo-spanish-style-chorizos-1-each-2090081
6834125,Jarlsberg Regular Cheese Sliced/Shaved | approx 100g,$3.40,https://www.coles.com.au/product/jarlsberg-regular-cheese-slicedshaved-approx.-100g-each-6834125
4273050,Coles Deli Thawed Cooked Vannamei Prawns | approx 250g,$5.00,https://www.coles.com.au/product/coles-deli-thawed-cooked-vannamei-prawns-approx.-250g-4273050
5766450,Coles Deli Thawed Raw Whole Gulf Squid | approx 250g,$5.25,https://www.coles.com.au/product/coles-deli-thawed-raw-whole-gulf-squid-approx.-250g-5766450
5051494,Coles Australian Made Champagne Ham | approx 125g,$2.88,https://www.coles.com.au/product/coles-australian-made-champagne-ham-approx.-125g-5051494
9065548,Primo Manuka Honey Leg Ham | 100g,$3.70,https://www.coles.com.au/product/primo-manuka-honey-leg-ham-100g-9065548
3055086,Primo Gluten Free Thinly Sliced Champagne Leg ... 100g,$3.70,https://www.coles.com.au/product/primo-gluten-free-thinly-sliced-champagne-leg-ham-100g-3055086
4222343,Primo Red Gum Honey Leg Ham | approx 100g,$2.60,https://www.coles.com.au/product/primo-red-gum-honey-leg-ham-approx.-100g-4222343
2814057,Primo Chicken Breast Thinly Sliced | 80g,$3.70,https://www.coles.com.au/product/primo-chicken-breast-thinly-sliced-80g-2814057
5495432,Coles Ham Off The Bone | approx 100g,$2.90,https://www.coles.com.au/product/coles-ham-off-the-bone-approx.-100g-5495432
9672959,Coles Deli Thawed Australian Cooked Black Tiger Pra ... approx 250g,$8.00,https://www.coles.com.au/product/coles-deli-thawed-australian-cooked-black-tiger-prawns-large-approx.-250g-9672959
3055519,Primo Short Cut Bacon | 1 kg,$12.00,https://www.coles.com.au/product/primo-short-cut-bacon-1-kg-3055519
6284590,Don English Style Sliced Ham | 200g,$6.40,https://www.coles.com.au/product/don-english-style-sliced-ham-200g-6284590
1471636,Coles Deli Roast Beef | approx 100g,$2.95,https://www.coles.com.au/product/coles-deli-roast-beef-approx.-100g-1471636
4304302,Primo Streaky Bacon | approx 100g,$1.70,https://www.coles.com.au/product/primo-streaky-bacon-approx.-100g-4304302
2814013,Primo Mild Hungarian Salami | 80g,$3.70,https://www.coles.com.au/product/primo-mild-hungarian-salami-80g-2814013
6284545,Don Double Smoked Leg Ham | 200g,$6.40,https://www.coles.com.au/product/don-double-smoked-leg-ham-200g-6284545
2517845,Hans Mild Twiggy Sticks | 500g,$14.50,https://www.coles.com.au/product/hans-mild-twiggy-sticks-500g-2517845
3098748,Riverview Farms Hot Roast Pork | 1 each,$20.00,https://www.coles.com.au/product/riverview-farms-hot-roast-pork-1-each-3098748
6677184,Bertocchi Hot Soppressa Salami | approx 125g,$4.50,https://www.coles.com.au/product/bertocchi-hot-soppressa-salami-approx.-125g-6677184
3606022,Barkly Grandmother Full Leg Ham | approx 100g,$3.90,https://www.coles.com.au/product/barkly-grandmother-full-leg-ham-approx.-100g-3606022
2819436,Primo Gluten Free Thinly Sliced Double Smoked Leg Ham | 100g,$3.70,https://www.coles.com.au/product/primo-gluten-free-thinly-sliced-double-smoked-leg-ham-100g-2819436
5795130,Wonder White Bread + Vitamins & Mineral | 700g,$4.40,https://www.coles.com.au/product/wonder-white-bread-+-vitamins-and-mineral-700g-5795130
248797,Don Deli Strasburg | approx 100g,$1.90,https://www.coles.com.au/product/don-deli-strasburg-approx.-100g-248797
6284603,Don Honey Leg Ham | 200g,$6.40,https://www.coles.com.au/product/don-honey-leg-ham-200g-6284603
2076615,Hans Mild Twiggy Sticks | approx 100g,$3.35,https://www.coles.com.au/product/hans-mild-twiggy-sticks-approx.-100g-2076615
4712863,Primo Traditional Bacon Pieces | approx 100g,$1.60,https://www.coles.com.au/product/primo-traditional-bacon-pieces-approx.-100g-4712863
3066934,Coles Deli Express Mediterranean Olives | 130g,$3.50,https://www.coles.com.au/product/coles-deli-express-mediterranean-olives-130g-3066934
3950913,Thomson's Deli Chicken Loaf | approx 100g,$1.50,https://www.coles.com.au/product/thomson's-deli-chicken-loaf-approx.-100g-3950913
6120548,Coles RSPCA Approved Southern Hot Roast Chicken | 1 each,$13.00,https://www.coles.com.au/product/coles-rspca-approved-southern-hot-roast-chicken-1-each-6120548
4260568,Primo Short Cut Bacon | 200g,$6.20,https://www.coles.com.au/product/primo-short-cut-bacon-200g-4260568
3359400,Coles RSPCA Approved BBQ Roasted Chicken Breast | approx 100g,$2.20,https://www.coles.com.au/product/coles-rspca-approved-bbq-roasted-chicken-breast-approx.-100g-3359400
3066945,Coles Deli Express Split Green Olives | 110g,$3.50,https://www.coles.com.au/product/coles-deli-express-split-green-olives-110g-3066945
3930440,Thomson's Deli Short Cut Bacon | 200g,$3.80,https://www.coles.com.au/product/thomson's-deli-short-cut-bacon-200g-3930440
6671315,Coles Deli Fromager D'Affinois | approx200g,$16.80,https://www.coles.com.au/product/coles-deli-fromager-d'affinois-approx.200g-6671315
6487531,Coles Deli Thawed Cooked Prawn Plate Small | 200g,$8.00,https://www.coles.com.au/product/coles-deli-thawed-cooked-prawn-plate-small-200g-6487531
6284589,Don Mild Hungarian Salami | 160g,$6.40,https://www.coles.com.au/product/don-mild-hungarian-salami-160g-6284589
4238285,Primo Dairy Short Cut Rindless Bacon | 750g,$15.50,https://www.coles.com.au/product/primo-dairy-short-cut-rindless-bacon-750g-4238285
1472617,Coles Deli Pastrami | approx 100g,$3.10,https://www.coles.com.au/product/coles-deli-pastrami-approx.-100g-1472617
4379855,Thomson's Deli Thin Franks | 500g,$2.50,https://www.coles.com.au/product/thomson's-deli-thin-franks-500g-4379855
5554156,Coles Giant Pitted Kalamata Olives | approx 100g,$2.00,https://www.coles.com.au/product/coles-giant-pitted-kalamata-olives-approx.-100g-5554156
4379731,Thomson's Deli Cocktail Franks | 500g,$2.50,https://www.coles.com.au/product/thomson's-deli-cocktail-franks-500g-4379731
2517856,Hans Hot Twiggy Sticks | 500g,$14.50,https://www.coles.com.au/product/hans-hot-twiggy-sticks-500g-2517856
3053513,Coles Honey Sliced Ham Sow Stall Free | 100g,$2.30,https://www.coles.com.au/product/coles-honey-sliced-ham-sow-stall-free-100g-3053513
5644237,Primo 25% Salt Reduced Leg Ham | 100g,$3.70,https://www.coles.com.au/product/primo-25percent-salt-reduced-leg-ham-100g-5644237
3575927,Tibaldi Ham Off The Bone | 120g,$5.00,https://www.coles.com.au/product/tibaldi-ham-off-the-bone-120g-3575927
6677242,Bertocchi Mild Soppressa Salami | approx 125g,$4.50,https://www.coles.com.au/product/bertocchi-mild-soppressa-salami-approx.-125g-6677242
6481444,Coles Semi Dried Tomatoe Fresh Basil | 135g,$3.50,https://www.coles.com.au/product/coles-semi-dried-tomatoe-fresh-basil-135g-6481444
6284614,Don Chicken Breast | 160g,$6.40,https://www.coles.com.au/product/don-chicken-breast-160g-6284614
2848547,Bertocchi Soppressa Extra Hot Chilli | approx100g,$3.60,https://www.coles.com.au/product/bertocchi-soppressa-extra-hot-chilli-approx.100g-2848547
6298641,Petite Cuisine Hash Brown | 1 each,$1.00,https://www.coles.com.au/product/petite-cuisine-hash-brown-1-each-6298641
3209714,Coles Deli Express Green Olives & Danish Fetta | 120g,$3.50,https://www.coles.com.au/product/coles-deli-express-green-olives-and-danish-fetta-120g-3209714
6483585,Coles Giant Pitted Kalamata Olives | 110g,$3.50,https://www.coles.com.au/product/coles-giant-pitted-kalamata-olives-110g-6483585
2140871,Primo Thin Frankfurt | 1kg,$7.40,https://www.coles.com.au/product/primo-thin-frankfurt-1kg-2140871
7312850,Primo Thin Frankfurts | approx 100g,$0.90,https://www.coles.com.au/product/primo-thin-frankfurts-approx.-100g-7312850
3218395,La Casa Del Formaggio Traditional Ricotta | approx 100g,$1.06,https://www.coles.com.au/product/la-casa-del-formaggio-traditional-ricotta-approx.-100g-3218395
2808735,Primo Pepperoni Hot Salami | 80g,$3.70,https://www.coles.com.au/product/primo-pepperoni-hot-salami-80g-2808735
4261040,Primo Streaky Bacon | 650g,$15.50,https://www.coles.com.au/product/primo-streaky-bacon-650g-4261040
3067835,Coles Deli Mediterranean Olives | approx 100g,$2.20,https://www.coles.com.au/product/coles-deli-mediterranean-olives-approx.-100g-3067835
3048069,Coles Deli RSPCA Approved Chicken Breast Kebab Honey Soy ... 1 each,$1.30,https://www.coles.com.au/product/coles-deli-rspca-approved-chicken-breast-kebab-honey-soy-1-each-3048069
2090310,Primo Cheese Kransky | 1 each,$2.70,https://www.coles.com.au/product/primo-cheese-kransky-1-each-2090310
2807856,Primo Gluten Free Thinly Sliced Danish Mild Salami | 80g,$3.70,https://www.coles.com.au/product/primo-gluten-free-thinly-sliced-danish-mild-salami-80g-2807856
2822260,Primo Gluten Free Thinly Sliced Pastrami Beef | 80g,$3.70,https://www.coles.com.au/product/primo-gluten-free-thinly-sliced-pastrami-beef-80g-2822260
3174904,Coles Mild Chorizo Salami | approx 100g,$3.70,https://www.coles.com.au/product/coles-mild-chorizo-salami-approx.-100g-3174904
2140860,Primo Frankfurt Cocktail | 1kg,$7.40,https://www.coles.com.au/product/primo-frankfurt-cocktail-1kg-2140860
5186449,Don Skinless Cocktail Frankfurt's | approx 50g,$0.69,https://www.coles.com.au/product/don-skinless-cocktail-frankfurt's-approx.-50g-each-5186449
1962751,Bertocchi Long Rindless Bacon | 400g,$8.00,https://www.coles.com.au/product/bertocchi-long-rindless-bacon-400g-1962751
9777094,Bertocchi Regular Mortadella | approx 100g,$1.15,https://www.coles.com.au/product/bertocchi-regular-mortadella-approx.-100g-9777094
499618,Primo Deli Cocktail Frankfurts | approx 50g,$0.45,https://www.coles.com.au/product/primo-deli-cocktail-frankfurts-approx.-50g-each-499618
1028220,Thomson's Deli Middle Bacon | 1kg,$10.25,https://www.coles.com.au/product/thomson's-deli-middle-bacon-1kg-1028220
4746694,Coles Deli Fresh Salmon Fins | approx 250g,$3.75,https://www.coles.com.au/product/coles-deli-fresh-salmon-fins-approx.-250g-4746694
5515813,Don Pepperoni Salami | approx 100g,$3.30,https://www.coles.com.au/product/don-pepperoni-salami-approx.-100g-5515813
2822259,Primo Roast Beef Thinly Sliced | 80g,$3.70,https://www.coles.com.au/product/primo-roast-beef-thinly-sliced-80g-2822259
2531664,Wurstel Chorizo | 300g,$6.50,https://www.coles.com.au/product/wurstel-chorizo-300g-2531664
5738556,Hans American Hot Dog Franks | 375g,$6.30,https://www.coles.com.au/product/hans-american-hot-dog-franks-375g-5738556
3269170,Provedore Prosciutto | 100g,$7.00,https://www.coles.com.au/product/provedore-prosciutto-100g-3269170
2819312,Thomson's Deli Cooking Bacon | 1kg,$8.80,https://www.coles.com.au/product/thomson's-deli-cooking-bacon-1kg-2819312
2421280,Don Deli Leg Ham | approx 100g,$1.80,https://www.coles.com.au/product/don-deli-leg-ham-approx.-100g-2421280
9860267,Primo Deli Pork Roast | approx 100g,$2.75,https://www.coles.com.au/product/primo-deli-pork-roast-approx.-100g-9860267
6483596,Coles Antipasto Mix | 120g,$3.50,https://www.coles.com.au/product/coles-antipasto-mix-120g-6483596
1024106,Coles Deli Fresh Saddletail Snapper Fillet | approx 250g,$9.00,https://www.coles.com.au/product/coles-deli-fresh-saddletail-snapper-fillet-approx.-250g-each-1024106
3067824,Coles Deli  Green Olives with Chilli Garlic | approx 100g,$1.98,https://www.coles.com.au/product/coles-deli-green-olives-with-chilli-garlic-approx.-100g-3067824
2807460,Primo Gluten Free Cheese Kransky | 250g,$4.50,https://www.coles.com.au/product/primo-gluten-free-cheese-kransky-250g-2807460
3081290,Coles Shredded Roast Chicken Breast | 150g,$6.00,https://www.coles.com.au/product/coles-shredded-roast-chicken-breast-150g-3081290
3930461,Thomson's Deli Mild Hungarian Salami | 320g,$6.60,https://www.coles.com.au/product/thomson's-deli-mild-hungarian-salami-320g-3930461
3913087,Coles Deli Express Mild Hungarian Sliced Salami | 150g,$7.00,https://www.coles.com.au/product/coles-deli-express-mild-hungarian-sliced-salami-150g-3913087
3576271,Primo Hot Hungarian Salami | 80g,$3.70,https://www.coles.com.au/product/primo-hot-hungarian-salami-80g-3576271
8146087,Primo Shredded Ham Twin Pack | 300g,$5.20,https://www.coles.com.au/product/primo-shredded-ham-twin-pack-300g-8146087
3055494,Primo Streaky Rindless Bacon | 200g,$6.20,https://www.coles.com.au/product/primo-streaky-rindless-bacon-200g-3055494
6284680,Don Italian Style Shaved Salami | 160g,$6.40,https://www.coles.com.au/product/don-italian-style-shaved-salami-160g-6284680
3277463,Bertocchi Short Rindless Bacon | 400g,$8.00,https://www.coles.com.au/product/bertocchi-short-rindless-bacon-400g-3277463
3386072,Coles Deli RSPCA Approved Chicken Breast Satay St ... 1 each,$1.30,https://www.coles.com.au/product/coles-deli-rspca-approved-chicken-breast-satay-style-kebab-1-each-3386072
9052375,Don Traditional Kabana | 200g,$5.80,https://www.coles.com.au/product/don-traditional-kabana-200g-9052375
6998745,Primo Classic Chorizo 2 Pack | 250g,$6.40,https://www.coles.com.au/product/primo-classic-chorizo-2-pack-250g-6998745
5249527,Don Dairy Strasburg Knob | 500g,$7.30,https://www.coles.com.au/product/don-dairy-strasburg-knob-500g-5249527
3930439,Thomson's Deli Short Cut Bacon | 1.25kg,$12.80,https://www.coles.com.au/product/thomson's-deli-short-cut-bacon-1.25kg-3930439
3605380,Coles Marinated Whole Button Mushrooms With Rosemary | 110g,$5.00,https://www.coles.com.au/product/coles-marinated-whole-button-mushrooms-with-rosemary-110g-3605380
2272715,Coles Deli Rspca Approved Chicken Wings | approx 120g,$0.84,https://www.coles.com.au/product/coles-deli-rspca-approved-chicken-wings-approx.-120g-each-2272715
1957139,Frank's Original Redhot Sauce | 148mL,$3.50,https://www.coles.com.au/product/frank's-original-redhot-sauce-148ml-1957139
3839020,Coles Hot Roast Beef | 1 each,$15.00,https://www.coles.com.au/product/coles-hot-roast-beef-1-each-3839020
4258180,Don Crafted Cuts Double Smoked Pansize Bacon | 200g,$5.30,https://www.coles.com.au/product/don-crafted-cuts-double-smoked-pansize-bacon-200g-4258180
3174880,Coles Italian Style Salami | approx 100g,$3.70,https://www.coles.com.au/product/coles-italian-style-salami-approx.-100g-3174880
1091941,R & S Danube Black Forest Rare Roast Beef | approx 100g,$3.80,https://www.coles.com.au/product/r-and-s-danube-black-forest-rare-roast-beef-approx.-100g-1091941
9681767,Coles Deli RSPCA Approved Chicken Crumbed Schni ... 1 each,$2.50,https://www.coles.com.au/product/coles-deli-rspca-approved-chicken-crumbed-schnitzel-1-each-9681767
2452976,Fine Foods Cracked Pepper Wafer Crackers | 100g,$3.50,https://www.coles.com.au/product/fine-foods-cracked-pepper-wafer-crackers-100g-2452976
4381879,Thomson's Deli Sliced Chicken Quad Pack | 320g,$5.70,https://www.coles.com.au/product/thomson's-deli-sliced-chicken-quad-pack-320g-4381879
1500290,Don Cocktail Franks Skinless | 600g,$7.80,https://www.coles.com.au/product/don-cocktail-franks-skinless-600g-1500290
4144829,Coles Deli RSPCA Approved Chicken Schnitzel | 250g,$4.00,https://www.coles.com.au/product/coles-deli-rspca-approved-chicken-schnitzel-250g-4144829
3075083,Deli Express Ivans Quiche Lorraine | 180g,$6.00,https://www.coles.com.au/product/deli-express-ivans-quiche-lorraine-180g-3075083
6992465,Primo Prosciutto | 100g,$6.00,https://www.coles.com.au/product/primo-prosciutto-100g-6992465
4259897,Primo Rindless Middle Bacon | 250g,$6.20,https://www.coles.com.au/product/primo-rindless-middle-bacon-250g-4259897
2807120,Coles Pepperoni | 200g,$6.90,https://www.coles.com.au/product/coles-pepperoni-200g-2807120
1500304,Don Gluten Free Footy Franks Skinless | 600g,$7.80,https://www.coles.com.au/product/don-gluten-free-footy-franks-skinless-600g-1500304
1026032,Coles Deli Seafood Salad | approx 250g,$4.75,https://www.coles.com.au/product/coles-deli-seafood-salad-approx.-250g-1026032
1113228,Coles Deli Vine Leaves Stuffed Dolmades | 1 each,$0.50,https://www.coles.com.au/product/coles-deli-vine-leaves-stuffed-dolmades-1-each-1113228
6359495,Coles Pitted Green Olives With Thyme Garlic Red Wine | approx ... approx 100g,$1.60,https://www.coles.com.au/product/coles-pitted-green-olives-with-thyme-garlic-red-wine-approx.-100g-6359495
222782,Coles Deli Thawed MSC Smoked Cod Fillet | approx 200g,$2.60,https://www.coles.com.au/product/coles-deli-thawed-msc-smoked-cod-fillet-approx.-200g-each-222782
3830037,Coles Australian Made Thin Sliced Streaky Bacon | 200g,$6.70,https://www.coles.com.au/product/coles-australian-made-thin-sliced-streaky-bacon-200g-3830037
5186777,Don Pariser | approx 100g,$1.75,https://www.coles.com.au/product/don-pariser-approx.-100g-5186777
6481546,Coles Green Olives Chilli & Garlic | 110g,$3.50,https://www.coles.com.au/product/coles-green-olives-chilli-and-garlic-110g-6481546
3270963,Primo Silverside | 80g,$3.70,https://www.coles.com.au/product/primo-silverside-80g-3270963
3576690,Primo Mortadella Slices | 100g,$3.70,https://www.coles.com.au/product/primo-mortadella-slices-100g-3576690
6284669,Don Ready To Eat Kabana Minis | 140g,$5.00,https://www.coles.com.au/product/don-ready-to-eat-kabana-minis-140g-6284669
5009250,Don Crafted Cut Bacon Shortcut | 200g,$5.30,https://www.coles.com.au/product/don-crafted-cut-bacon-shortcut-200g-5009250
3453293,Coles Deli Thawed Australian MSC Raw Peeled B ... approx 250g,$11.50,https://www.coles.com.au/product/coles-deli-thawed-australian-msc-raw-peeled-banana-prawn-meat-approx.-250g-3453293
5601143,Primo Prosciutto Boneless | approx 100g,$4.90,https://www.coles.com.au/product/primo-prosciutto-boneless-approx.-100g-5601143
2449676,Natural  Wafer Crackers | 100g,$3.50,https://www.coles.com.au/product/natural-wafer-crackers-100g-2449676
5009272,Provedore Salami Tasting Plate | 100g,$7.00,https://www.coles.com.au/product/provedore-salami-tasting-plate-100g-5009272
2792395,OB Finest Cranberry & Pumpkin Seed Crackers | 150g,$6.50,https://www.coles.com.au/product/ob-finest-cranberry-and-pumpkin-seed-crackers-150g-2792395
1873039,Coles BBQ Seasoned Shredded Chicken | approx100g,$2.80,https://www.coles.com.au/product/coles-bbq-seasoned-shredded-chicken-approx.100g-1873039
2072997,Hans Hot Twiggy Sticks | approx 100g,$3.35,https://www.coles.com.au/product/hans-hot-twiggy-sticks-approx.-100g-2072997
4258690,Don Crafted Cuts Streaky Bacon | 180g,$5.30,https://www.coles.com.au/product/don-crafted-cuts-streaky-bacon-180g-4258690
2805362,British Sausage Co Smoked Back Bacon | 200g,$7.00,https://www.coles.com.au/product/british-sausage-co-smoked-back-bacon-200g-2805362
3775813,Fragassi Basilico Pasta Sauce | 500g,$8.30,https://www.coles.com.au/product/fragassi-basilico-pasta-sauce-500g-3775813
7428265,Coles Deli RSPCA Approved Chicken Nibbles H ... approx 70g,$0.63,https://www.coles.com.au/product/coles-deli-rspca-approved-chicken-nibbles-honey-soy-approx.-70g-7428265
3763596,Coles Deli Thawed MSC Raw Lobster Tails | 1 each,$10.00,https://www.coles.com.au/product/coles-deli-thawed-msc-raw-lobster-tails-1-each-3763596
9363954,Don Liverwurst Latvian | 100g,$2.50,https://www.coles.com.au/product/don-liverwurst-latvian-100g-9363954
3053080,OB Finest Gluten Free Wafer Crackers | 100g,$3.50,https://www.coles.com.au/product/ob-finest-gluten-free-wafer-crackers-100g-3053080
5651120,Coles Deli Express Roast Capsicum Strips | 130g,$3.50,https://www.coles.com.au/product/coles-deli-express-roast-capsicum-strips-130g-5651120
3930450,Thomson's Deli Streaky Bacon | 200g,$4.10,https://www.coles.com.au/product/thomson's-deli-streaky-bacon-200g-3930450
3465543,Coles Deli Express Kabana | 220g,$4.50,https://www.coles.com.au/product/coles-deli-express-kabana-220g-3465543
3165594,Coles Deli Thawed Peeled Garlic Prawns | approx 250g,$8.25,https://www.coles.com.au/product/coles-deli-thawed-peeled-garlic-prawns-approx.-250g-3165594
1017756,Coles Deli Thawed Seafood Highlighter | approx 250g,$1.50,https://www.coles.com.au/product/coles-deli-thawed-seafood-highlighter-approx.-250g-1017756
